lineage_row_id	export_row_id	source_row_id	component_row_id	curation_decision_id	mapping_id	transformation_rule_id	qc_override_id	final_value	alignment_class	upstream_source	upstream_ref	evidence_note	decision_note
lin::1	exp::1	src_yeast	cmp_yeast_ala		map_alanine	via_alanine		3.142889	local_proxy_or_override	dat/nutrients.tsv	cpd00035	workbook-derived decomposition row|upstream alanine compound|direct export retained after namespace mapping	no viable transformation beyond explicit direct export
lin::2	exp::2	src_yeast	cmp_yeast_cell		map_cellulose	poly_cellulose_cellobiose		0.030838	local_proxy_or_override	workbook_slice|dat/nutrients.tsv	local_cellulose|cpd00158	reduced polymer example for viable export proxy stage|cellulose retained upstream and proxied later for viable export|polymer proxy required because the model export uses a smaller viable proxy|cellulose proxy represented as one cellobiose per two anhydroglucose units	polymer proxy deferred to viable export stage|polymer proxy expressed explicitly in viable export stage|explicit viable polymer proxy
lin::3	exp::3	src_nacl	cmp_nacl_salt		map_nacl	salt_nacl_na		171.115674	local_proxy_or_override	workbook_slice|dat/nutrients.tsv	local_nacl_salt|cpd00971	NaCl retained as a mapped salt and split later in viable export|salt retained as a local placeholder and split later for viable export|salt must be split into viable member exports|NaCl yields one sodium-equivalent per mole	salt split deferred to viable export stage|salt split expressed explicitly in viable export stage|explicit viable sodium export member
lin::4	exp::4	src_nacl	cmp_nacl_salt		map_nacl	salt_nacl_cl		171.115674	local_proxy_or_override	workbook_slice|dat/nutrients.tsv	local_nacl_salt|cpd00099	NaCl retained as a mapped salt and split later in viable export|salt retained as a local placeholder and split later for viable export|salt must be split into viable member exports|NaCl yields one chloride-equivalent per mole	salt split deferred to viable export stage|salt split expressed explicitly in viable export stage|explicit viable chloride export member
lin::5	exp::5	src_lactic	cmp_lactic		map_lactic	chem_lactic_lactate		16.651865	local_proxy_or_override	workbook_slice	local_lactic_acid|local_l_lactate_model_form	lactic acid retained upstream and converted to lactate in viable export|neutral lactic acid is retained as a local placeholder before model-facing export changes form|model export uses lactate rather than neutral lactic acid|lactate is emitted as a local model-facing form because no upstream lactate id exists in this snapshot	chemical-form change deferred to viable export stage|chemical form change expressed explicitly in viable export stage|explicit viable chemical-form change
lin::6	exp::6			dec_o2	map_o2	via_o2		0	directly_aligned_with_gapseq_upstream	dat/nutrients.tsv	cpd00007	background species inserted explicitly for export parity|upstream oxygen compound|background species passes through directly	inserted as explicit background species|no viable transformation beyond explicit direct export
lin::7	exp::7			dec_h2o	map_h2o	via_h2o		1000	directly_aligned_with_gapseq_upstream	dat/nutrients.tsv	cpd00001	background species inserted explicitly for export parity|upstream water compound|background species passes through directly	inserted as explicit background species|no viable transformation beyond explicit direct export
lin::8	exp::8			dec_h	map_h	via_h		0.0001	directly_aligned_with_gapseq_upstream	dat/nutrients.tsv	cpd00067	background species inserted explicitly from pH assumption|upstream proton compound|background species passes through directly	inserted from simple pH assumption|no viable transformation beyond explicit direct export
